{
  "$schema": "../../schemas/sprocket-mod.schema.json",
  "schema_version": 1,
  "id": "furryaxw.penetration-mod",
  "name": "PenetrationMod",
  "authors": ["furryAxw"],
  "repository": "furryaxw/PenetrationMod",
  "license": "GPL-3.0-only",
  "display_name": {
    "en": "Penetration Limit Modifier",
    "zh": "穿深上限修改器"
  },
  "description": {
    "en": "Raises the caliber and penetration slider limits for the armor testing tool in the designer.",
    "zh": "提高设计器中装甲测试工具的火炮口径与穿深上限。"
  },
  "release": {
    "include_prerelease": false,
    "version_pattern": "^v?([0-9]+\\.[0-9]+\\.[0-9]+(?:-[0-9A-Za-z.-]+)?)$",
    "assets": {
      "include": ["PenetrationMod.dll"],
      "exclude": []
    }
  },
  "dependencies": [
    {
      "id": "furryaxw.sprocket-mod-api",
      "version": ">=0.3.0 <1.0.0",
      "when": "*"
    }
  ],
  "recommendations": [],
  "featured": false,
  "install": {
    "scan_dlls": true,
    "exclude": [],
    "overrides": []
  },
  "category": "gameplay",
  "tags": ["weapons", "designer", "penetration", "caliber"]
}
